Title,Length,Year,Rated,Released,Genre,RottenTomatoesRating,MetacriticRating,imdbRating,imdbVotes,imdbID,BoxOffice,Awards,Director,Writer,Actors,Plot,Language,Country,Type:
Avengers: Endgame,181 min,2019,PG-13,26 Apr 2019,"Action, Adventure, Drama",94%,78/100,8.4,"1,311,790",tt4154796,"$858,373,000",Nominated for 1 Oscar. 70 wins & 133 nominations total,"Anthony Russo, Joe Russo","Christopher Markus, Stephen McFeely, Stan Lee","Robert Downey Jr., Chris Evans, Mark Ruffalo","After the devastating events of Avengers: Infinity War (2018), the universe is in ruins. With the help of remaining allies, the Avengers assemble once more in order to reverse Thanos' actions and restore balance to the universe.","English, Japanese, Xhosa, German",United States,movie
Avengers: Infinity War,149 min,2018,PG-13,27 Apr 2018,"Action, Adventure, Sci-Fi",85%,68/100,8.4,"1,239,574",tt4154756,"$678,815,482",Nominated for 1 Oscar. 48 wins & 81 nominations total,"Anthony Russo, Joe Russo","Christopher Markus, Stephen McFeely, Stan Lee","Robert Downey Jr., Chris Hemsworth, Mark Ruffalo",The Avengers and their allies must be willing to sacrifice all in an attempt to defeat the powerful Thanos before his blitz of devastation and ruin puts an end to the universe.,English,"United States, Norway",movie
The Avengers,143 min,2012,PG-13,04 May 2012,"Action, Sci-Fi",91%,69/100,8.0,"1,481,025",tt0848228,"$623,357,910",Nominated for 1 Oscar. 39 wins & 81 nominations total,Joss Whedon,"Joss Whedon, Zak Penn","Robert Downey Jr., Chris Evans, Scarlett Johansson",Earth's mightiest heroes must come together and learn to fight as a team if they are going to stop the mischievous Loki and his alien army from enslaving humanity.,"English, Russian",United States,movie
Avengers: Age of Ultron,141 min,2015,PG-13,01 May 2015,"Action, Adventure, Sci-Fi",76%,66/100,7.3,"939,559",tt2395427,"$459,005,868",8 wins & 52 nominations,Joss Whedon,"Joss Whedon, Stan Lee, Jack Kirby","Robert Downey Jr., Chris Evans, Mark Ruffalo","When Tony Stark and Bruce Banner try to jump-start a dormant peacekeeping program called Ultron, things go horribly wrong and it's up to Earth's mightiest heroes to stop the villainous Ultron from enacting his terrible plan.","English, Korean",United States,movie
Iron Man,126 min,2008,PG-13,02 May 2008,"Action, Adventure, Sci-Fi",94%,79/100,7.9,"1,149,894",tt0371746,"$319,034,126",Nominated for 2 Oscars. 24 wins & 73 nominations total,Jon Favreau,"Mark Fergus, Hawk Ostby, Art Marcum","Robert Downey Jr., Gwyneth Paltrow, Terrence Howard","After being held captive in an Afghan cave, billionaire engineer Tony Stark creates a unique weaponized suit of armor to fight evil.","English, Persian, Urdu, Arabic, Kurdish, Hindi, Hungarian","United States, Canada",movie
Thor: Ragnarok,130 min,2017,PG-13,03 Nov 2017,"Action, Adventure, Comedy",93%,74/100,7.9,"834,531",tt3501632,"$315,058,289",6 wins & 50 nominations,Taika Waititi,"Eric Pearson, Craig Kyle, Christopher L. Yost","Chris Hemsworth, Tom Hiddleston, Cate Blanchett","Imprisoned on the planet Sakaar, Thor must race against time to return to Asgard and stop Ragnarök, the destruction of his world, at the hands of the powerful and ruthless villain Hela.",English,United States,movie
Captain America: Civil War,147 min,2016,PG-13,06 May 2016,"Action, Sci-Fi",90%,75/100,7.8,"868,859",tt3498820,"$408,084,349",16 wins & 73 nominations,"Anthony Russo, Joe Russo","Christopher Markus, Stephen McFeely, Joe Simon","Chris Evans, Robert Downey Jr., Scarlett Johansson",Political involvement in the Avengers' affairs causes a rift between Captain America and Iron Man.,"English, German, Xhosa, Russian, Romanian","United States, Germany",movie
Guardians of the Galaxy Vol. 3,150 min,2023,PG-13,05 May 2023,"Action, Adventure, Comedy",82%,64/100,7.9,"406,063",tt6791350,"$358,995,815",Nominated for 1 Oscar. 11 wins & 88 nominations total,James Gunn,"James Gunn, Jim Starlin, Stan Lee","Chris Pratt, Chukwudi Iwuji, Bradley Cooper","Still reeling from the loss of Gamora, Peter Quill rallies his team to defend the universe and one of their own - a mission that could mean the end of the Guardians if not successful.",English,"United States, New Zealand, France, Canada",movie
Spider-Man: No Way Home,148 min,2021,PG-13,17 Dec 2021,"Action, Adventure, Fantasy",93%,71/100,8.2,"912,258",tt10872600,"$814,866,759",Nominated for 1 Oscar. 35 wins & 71 nominations total,Jon Watts,"Chris McKenna, Erik Sommers, Stan Lee","Tom Holland, Zendaya, Benedict Cumberbatch","With Spider-Man's identity now revealed, Peter asks Doctor Strange for help. When a spell goes wrong, dangerous foes from other worlds start to appear.",English,United States,movie
Spider-Man: Far from Home,129 min,2019,PG-13,02 Jul 2019,"Action, Adventure, Comedy",91%,69/100,7.4,"575,059",tt6320628,"$391,283,774",11 wins & 26 nominations,Jon Watts,"Chris McKenna, Erik Sommers, Stan Lee","Tom Holland, Samuel L. Jackson, Jake Gyllenhaal","Peter Parker, the beloved superhero Spider-Man, faces four destructive elemental monsters while on holiday in Europe. Soon, he receives help from Mysterio, a fellow hero with mysterious origins.","English, Italian, Czech","United States, Czech Republic, Australia, Canada, Italy",movie
Spider-Man: No Way Home,148 min,2021,PG-13,17 Dec 2021,"Action, Adventure, Fantasy",93%,71/100,8.2,"912,258",tt10872600,"$814,866,759",Nominated for 1 Oscar. 35 wins & 71 nominations total,Jon Watts,"Chris McKenna, Erik Sommers, Stan Lee","Tom Holland, Zendaya, Benedict Cumberbatch","With Spider-Man's identity now revealed, Peter asks Doctor Strange for help. When a spell goes wrong, dangerous foes from other worlds start to appear.",English,United States,movie
The Amazing Spider-Man,136 min,2012,PG-13,03 Jul 2012,"Action, Adventure, Sci-Fi",71%,66/100,6.9,"717,733",tt0948470,"$262,782,352",2 wins & 33 nominations,Marc Webb,"James Vanderbilt, Alvin Sargent, Steve Kloves","Andrew Garfield, Emma Stone, Rhys Ifans","After Peter Parker is bitten by a genetically altered spider, he gains newfound, spider-like powers and ventures out to save the city from the machinations of a mysterious reptilian foe.",English,United States,movie
The Amazing Spider-Man 2,142 min,2014,PG-13,02 May 2014,"Action, Adventure, Sci-Fi",50%,53/100,6.6,"550,508",tt1872181,"$203,605,622",4 wins & 30 nominations,Marc Webb,"Alex Kurtzman, Roberto Orci, Jeff Pinkner","Andrew Garfield, Emma Stone, Jamie Foxx","When New York is put under siege by Oscorp, it is up to Spider-Man to save the city he swore to protect as well as his loved ones.",English,United States,movie
Spider-Man: Homecoming,133 min,2017,PG-13,07 Jul 2017,"Action, Adventure, Sci-Fi",92%,73/100,7.4,"739,249",tt2250912,"$334,952,829",8 wins & 10 nominations,Jon Watts,"Jonathan Goldstein, John Francis Daley, Jon Watts","Tom Holland, Michael Keaton, Robert Downey Jr.",Peter Parker tries to stop Adrian 'The Vulture' Toomes from selling weapons made with advanced Chitauri technology while trying to balance his life as an ordinary high school student.,"English, Spanish",United States,movie
The Shawshank Redemption,142 min,1994,R,14 Oct 1994,Drama,89%,82/100,9.3,"2,957,050",tt0111161,"$28,767,189",Nominated for 7 Oscars. 21 wins & 42 nominations total,Frank Darabont,"Stephen King, Frank Darabont","Tim Robbins, Morgan Freeman, Bob Gunton","A banker convicted of uxoricide forms a friendship over a quarter century with a hardened convict, while maintaining his innocence and trying to remain hopeful through simple compassion.",English,United States,movie
The Godfather,175 min,1972,R,24 Mar 1972,"Crime, Drama",97%,100/100,9.2,"2,068,172",tt0068646,"$136,381,073",Won 3 Oscars. 31 wins & 31 nominations total,Francis Ford Coppola,"Mario Puzo, Francis Ford Coppola","Marlon Brando, Al Pacino, James Caan",The aging patriarch of an organized crime dynasty transfers control of his clandestine empire to his reluctant son.,"English, Italian, Latin",United States,movie
The Dark Knight,152 min,2008,PG-13,18 Jul 2008,"Action, Crime, Drama",94%,84/100,9.0,"2,947,373",tt0468569,"$534,987,076",Won 2 Oscars. 164 wins & 164 nominations total,Christopher Nolan,"Jonathan Nolan, Christopher Nolan, David S. Goyer","Christian Bale, Heath Ledger, Aaron Eckhart","When a menace known as the Joker wreaks havoc and chaos on the people of Gotham, Batman, James Gordon and Harvey Dent must work together to put an end to the madness.","English, Mandarin","United States, United Kingdom",movie
Pulp Fiction,154 min,1994,R,14 Oct 1994,"Crime, Drama",92%,95/100,8.9,"2,277,294",tt0110912,"$107,928,762",Won 1 Oscar. 69 wins & 72 nominations total,Quentin Tarantino,"Quentin Tarantino, Roger Avary","John Travolta, Uma Thurman, Samuel L. Jackson","The lives of two mob hitmen, a boxer, a gangster and his wife, and a pair of diner bandits intertwine in four tales of violence and redemption.","English, Spanish, French",United States,movie
Schindler's List,195 min,1993,R,04 Feb 1994,"Biography, Drama, History",98%,95/100,9.0,"1,487,349",tt0108052,"$96,898,818",Won 7 Oscars. 91 wins & 49 nominations total,Steven Spielberg,"Thomas Keneally, Steven Zaillian","Liam Neeson, Ralph Fiennes, Ben Kingsley","In German-occupied Poland during World War II, industrialist Oskar Schindler gradually becomes concerned for his Jewish workforce after witnessing their persecution by the Nazis.","English, Hebrew, German, Polish, Latin",United States,movie
The Lord of the Rings: The Return of the King,201 min,2003,PG-13,17 Dec 2003,"Action, Adventure, Drama",94%,94/100,9.0,"2,024,305",tt0167260,"$381,878,219",Won 11 Oscars. 215 wins & 124 nominations total,Peter Jackson,"J.R.R. Tolkien, Fran Walsh, Philippa Boyens","Elijah Wood, Viggo Mortensen, Ian McKellen",Gandalf and Aragorn lead the World of Men against Sauron's army to draw his gaze from Frodo and Sam as they approach Mount Doom with the One Ring.,"English, Quenya, Old English, Sindarin","New Zealand, United States",movie
Forrest Gump,142 min,1994,PG-13,06 Jul 1994,"Drama, Romance",75%,82/100,8.8,"2,314,429",tt0109830,"$330,455,270",Won 6 Oscars. 51 wins & 74 nominations total,Robert Zemeckis,"Winston Groom, Eric Roth","Tom Hanks, Robin Wright, Gary Sinise","The history of the United States from the 1950s to the '70s unfolds from the perspective of an Alabama man with an IQ of 75, who yearns to be reunited with his childhood sweetheart.",English,United States,movie
Fight Club,139 min,1999,R,15 Oct 1999,Drama,81%,67/100,8.8,"2,397,013",tt0137523,"$37,030,102",Nominated for 1 Oscar. 12 wins & 38 nominations total,David Fincher,"Chuck Palahniuk, Jim Uhls","Brad Pitt, Edward Norton, Meat Loaf",An insomniac office worker and a devil-may-care soap maker form an underground fight club that evolves into much more.,English,"Germany, United States",movie
Inception,148 min,2010,PG-13,16 Jul 2010,"Action, Adventure, Sci-Fi",87%,74/100,8.8,"2,615,361",tt1375666,"$292,587,330",Won 4 Oscars. 159 wins & 220 nominations total,Christopher Nolan,Christopher Nolan,"Leonardo DiCaprio, Joseph Gordon-Levitt, Elliot Page","A thief who steals corporate secrets through the use of dream-sharing technology is given the inverse task of planting an idea into the mind of a C.E.O., but his tragic past may doom the project and his team to disaster.","English, Japanese, French","United States, United Kingdom",movie
The Matrix,136 min,1999,R,31 Mar 1999,"Action, Sci-Fi",83%,73/100,8.7,"2,105,403",tt0133093,"$172,076,928",Won 4 Oscars. 42 wins & 52 nominations total,"Lana Wachowski, Lilly Wachowski","Lilly Wachowski, Lana Wachowski","Keanu Reeves, Laurence Fishburne, Carrie-Anne Moss","When a beautiful stranger leads computer hacker Neo to a forbidding underworld, he discovers the shocking truth--the life he knows is the elaborate deception of an evil cyber-intelligence.",English,"United States, Australia",movie
Goodfellas,145 min,1990,R,21 Sep 1990,"Biography, Crime, Drama",95%,92/100,8.7,"1,287,118",tt0099685,"$46,909,721",Won 1 Oscar. 44 wins & 38 nominations total,Martin Scorsese,"Nicholas Pileggi, Martin Scorsese","Robert De Niro, Ray Liotta, Joe Pesci","The story of Henry Hill and his life in the mafia, covering his relationship with his wife Karen and his mob partners Jimmy Conway and Tommy DeVito.","English, Italian, Hebrew, Yiddish",United States,movie
Star Wars: Episode V - The Empire Strikes Back,124 min,1980,PG,18 Jun 1980,"Action, Adventure, Fantasy",95%,82/100,8.7,"1,410,938",tt0080684,"$292,753,960",Won 1 Oscar. 27 wins & 20 nominations total,Irvin Kershner,"Leigh Brackett, Lawrence Kasdan, George Lucas","Mark Hamill, Harrison Ford, Carrie Fisher","After the Empire overpowers the Rebel Alliance, Luke Skywalker begins his Jedi training with Yoda. At the same time, Darth Vader and bounty hunter Boba Fett pursue his friends across the galaxy.",English,United States,movie
One Flew Over the Cuckoo's Nest,133 min,1975,R,19 Nov 1975,Drama,93%,84/100,8.7,"1,094,306",tt0073486,"$108,981,275",Won 5 Oscars. 38 wins & 15 nominations total,Milos Forman,"Lawrence Hauben, Bo Goldman, Ken Kesey","Jack Nicholson, Louise Fletcher, Michael Berryman","In the Fall of 1963, a Korean War veteran and criminal pleads insanity and is admitted to a mental institution, where he rallies up the scared patients against the tyrannical nurse.",English,United States,movie
Seven Samurai,207 min,1954,Not Rated,19 Nov 1956,"Action, Drama",100%,98/100,8.6,"373,943",tt0047478,"$800,916",Nominated for 2 Oscars. 5 wins & 9 nominations total,Akira Kurosawa,"Akira Kurosawa, Shinobu Hashimoto, Hideo Oguni","Toshirô Mifune, Takashi Shimura, Keiko Tsushima","Farmers from a village exploited by bandits hire a veteran samurai for protection, who gathers six other samurai to join him.",Japanese,Japan,movie
City of God,130 min,2002,R,13 Feb 2004,"Crime, Drama",91%,79/100,8.6,"817,002",tt0317248,"$7,564,459",Nominated for 4 Oscars. 75 wins & 50 nominations total,"Fernando Meirelles, Kátia Lund","Paulo Lins, Bráulio Mantovani","Alexandre Rodrigues, Leandro Firmino, Matheus Nachtergaele","In the slums of Rio, two kids' paths diverge as one struggles to become a photographer and the other a kingpin.",Portuguese,"Brazil, France",movie
The Silence of the Lambs,118 min,1991,R,14 Feb 1991,"Crime, Drama, Thriller",95%,86/100,8.6,"1,592,715",tt0102926,"$130,742,922",Won 5 Oscars. 71 wins & 50 nominations total,Jonathan Demme,"Thomas Harris, Ted Tally","Jodie Foster, Anthony Hopkins, Scott Glenn","A young F.B.I. cadet must receive the help of an incarcerated and manipulative cannibal killer to help catch another serial killer, a madman who skins his victims.","English, Latin",United States,movie
It's a Wonderful Life,130 min,1946,PG,07 Jan 1947,"Drama, Family, Fantasy",94%,89/100,8.6,"507,065",tt0038650,"$1,483,643",Nominated for 5 Oscars. 7 wins & 6 nominations total,Frank Capra,"Frances Goodrich, Albert Hackett, Frank Capra","James Stewart, Donna Reed, Lionel Barrymore",An angel is sent from Heaven to help a desperately frustrated businessman by showing him what life would have been like if he had never existed.,"English, French",United States,movie
Life Is Beautiful,116 min,1997,PG-13,20 Dec 1997,"Comedy, Drama, Romance",81%,59/100,8.6,"757,812",tt0118799,"$57,563,264",Won 3 Oscars. 72 wins & 52 nominations total,Roberto Benigni,"Vincenzo Cerami, Roberto Benigni","Roberto Benigni, Nicoletta Braschi, Giorgio Cantarini","When an open-minded Jewish waiter and his son become victims of the Holocaust, he uses a perfect mixture of will, humor and imagination to protect his son from the dangers around their camp.","Italian, German, English",Italy,movie
The Usual Suspects,106 min,1995,R,16 Aug 1995,"Crime, Drama, Mystery",87%,77/100,8.5,"1,164,538",tt0114814,"$23,341,568",Won 2 Oscars. 37 wins & 17 nominations total,Bryan Singer,Christopher McQuarrie,"Kevin Spacey, Gabriel Byrne, Chazz Palminteri",The sole survivor of a pier shoot-out tells the story of how a notorious criminal influenced the events that began with five criminals meeting in a seemingly random police lineup.,"English, Hungarian, Spanish, French","Germany, United States",movie
Se7en,127 min,1995,R,22 Sep 1995,"Crime, Drama, Mystery",83%,65/100,8.6,"1,853,781",tt0114369,"$100,125,643",Nominated for 1 Oscar. 29 wins & 44 nominations total,David Fincher,Andrew Kevin Walker,"Morgan Freeman, Brad Pitt, Kevin Spacey","Two detectives, a rookie and a veteran, hunt a serial killer who uses the seven deadly sins as his motives.",English,United States,movie
The Lion King,88 min,1994,G,24 Jun 1994,"Animation, Adventure, Drama",92%,88/100,8.5,"1,168,861",tt0110357,"$424,979,720",Won 2 Oscars. 43 wins & 35 nominations total,"Roger Allers, Rob Minkoff","Irene Mecchi, Jonathan Roberts, Linda Woolverton","Matthew Broderick, Jeremy Irons, James Earl Jones","Lion prince Simba and his father are targeted by his bitter uncle, who wants to ascend the throne himself.","English, Swahili, Xhosa, Zulu",United States,movie
The Departed,151 min,2006,R,06 Oct 2006,"Crime, Drama, Thriller",91%,85/100,8.5,"1,448,203",tt0407887,"$132,399,394",Won 4 Oscars. 99 wins & 141 nominations total,Martin Scorsese,"William Monahan, Alan Mak, Felix Chong","Leonardo DiCaprio, Matt Damon, Jack Nicholson",An undercover cop and a mole in the police attempt to identify each other while infiltrating an Irish gang in South Boston.,"English, Cantonese","United States, Hong Kong",movie
Gladiator,155 min,2000,R,05 May 2000,"Action, Adventure, Drama",80%,67/100,8.5,"1,665,601",tt0172495,"$187,705,427",Won 5 Oscars. 60 wins & 104 nominations total,Ridley Scott,"David Franzoni, John Logan, William Nicholson","Russell Crowe, Joaquin Phoenix, Connie Nielsen",A former Roman General sets out to exact vengeance against the corrupt emperor who murdered his family and sent him into slavery.,English,"United States, United Kingdom, Malta, Morocco",movie
Terminator 2: Judgment Day,137 min,1991,R,03 Jul 1991,"Action, Adventure, Sci-Fi",91%,75/100,8.6,"1,200,133",tt0103064,"$205,881,154",Won 4 Oscars. 39 wins & 33 nominations total,James Cameron,"James Cameron, William Wisher","Arnold Schwarzenegger, Linda Hamilton, Edward Furlong","A cyborg, identical to the one who failed to kill Sarah Connor, must now protect her ten year old son John from an even more advanced and powerful cyborg.","English, Spanish","United States, France",movie
Back to the Future,116 min,1985,PG,03 Jul 1985,"Adventure, Comedy, Sci-Fi",93%,87/100,8.5,"1,343,792",tt0088763,"$214,077,472",Won 1 Oscar. 25 wins & 25 nominations total,Robert Zemeckis,"Robert Zemeckis, Bob Gale","Michael J. Fox, Christopher Lloyd, Lea Thompson","Marty McFly, a 17-year-old high school student, is accidentally sent 30 years into the past in a time-traveling DeLorean invented by his close friend, the maverick scientist Doc Brown.",English,United States,movie
Whiplash,106 min,2014,R,15 Oct 2014,"Drama, Music",94%,89/100,8.5,"1,031,275",tt2582802,"$14,003,391",Won 3 Oscars. 98 wins & 144 nominations total,Damien Chazelle,Damien Chazelle,"Miles Teller, J.K. Simmons, Melissa Benoist",A promising young drummer enrolls at a cut-throat music conservatory where his dreams of greatness are mentored by an instructor who will stop at nothing to realize a student's potential.,English,United States,movie
The Prestige,130 min,2006,PG-13,20 Oct 2006,"Drama, Mystery, Sci-Fi",77%,66/100,8.5,"1,477,853",tt0482571,"$53,089,891",Nominated for 2 Oscars. 6 wins & 44 nominations total,Christopher Nolan,"Jonathan Nolan, Christopher Nolan, Christopher Priest","Christian Bale, Hugh Jackman, Scarlett Johansson",Rival 19th-century magicians engage in a bitter battle for trade secrets.,English,"United Kingdom, United States",movie
The Intouchables,112 min,2011,R,02 Nov 2011,"Comedy, Drama",76%,57/100,8.5,"953,565",tt1675434,"$10,198,820",Nominated for 1 BAFTA Award38 wins & 40 nominations total,"Olivier Nakache, Éric Toledano","Olivier Nakache, Éric Toledano, Philippe Pozzo di Borgo","François Cluzet, Omar Sy, Anne Le Ny","After he becomes a quadriplegic from a paragliding accident, an aristocrat hires a young man from the projects to be his caregiver.","French, English",France,movie
The Green Mile,189 min,1999,R,10 Dec 1999,"Crime, Drama, Fantasy",79%,61/100,8.6,"1,440,593",tt0120689,"$136,801,374",Nominated for 4 Oscars. 15 wins & 37 nominations total,Frank Darabont,"Stephen King, Frank Darabont","Tom Hanks, Michael Clarke Duncan, David Morse","A tale set on death row, where gentle giant John Coffey possesses the mysterious power to heal people's ailments. When the lead guard, Paul Edgecombe, recognizes John's gift, he tries to help stave off the condemned man's execution.","English, French",United States,movie
Parasite,132 min,2019,R,08 Nov 2019,"Drama, Thriller",99%,96/100,8.5,"1,008,905",tt6751668,"$53,369,749",Won 4 Oscars. 316 wins & 266 nominations total,Bong Joon Ho,"Bong Joon Ho, Han Jin-won","Song Kang-ho, Lee Sun-kyun, Cho Yeo-jeong",Greed and class discrimination threaten the newly formed symbiotic relationship between the wealthy Park family and the destitute Kim clan.,"Korean, English",South Korea,movie
The Pianist,150 min,2002,R,28 Mar 2003,"Biography, Drama, Music",95%,85/100,8.5,"936,992",tt0253474,"$32,590,750",Won 3 Oscars. 57 wins & 74 nominations total,Roman Polanski,"Ronald Harwood, Wladyslaw Szpilman","Adrien Brody, Thomas Kretschmann, Frank Finlay","During WWII, acclaimed Polish musician Wladyslaw faces various struggles as he loses contact with his family. As the situation worsens, he hides in the ruins of Warsaw in order to survive.","English, German, Russian","France, Poland, Germany, United Kingdom, United States",movie
The Lord of the Rings: The Fellowship of the Ring,178 min,2001,PG-13,19 Dec 2001,"Action, Adventure, Drama",92%,92/100,8.9,"2,054,361",tt0120737,"$319,372,078",Won 4 Oscars. 125 wins & 126 nominations total,Peter Jackson,"J.R.R. Tolkien, Fran Walsh, Philippa Boyens","Elijah Wood, Ian McKellen, Orlando Bloom",A meek Hobbit from the Shire and eight companions set out on a journey to destroy the powerful One Ring and save Middle-earth from the Dark Lord Sauron.,"English, Sindarin","New Zealand, United States, United Kingdom",movie
Interstellar,169 min,2014,PG-13,07 Nov 2014,"Adventure, Drama, Sci-Fi",73%,74/100,8.7,"2,191,773",tt0816692,"$188,020,017",Won 1 Oscar. 44 wins & 148 nominations total,Christopher Nolan,"Jonathan Nolan, Christopher Nolan","Matthew McConaughey, Anne Hathaway, Jessica Chastain","When Earth becomes uninhabitable in the future, a farmer and ex-NASA pilot, Joseph Cooper, is tasked to pilot a spacecraft, along with a team of researchers, to find a new planet for humans.",English,"United States, United Kingdom, Canada",movie
Jaws,124 min,1975,PG,20 Jun 1975,"Adventure, Drama, Thriller",97%,87/100,8.1,"677,803",tt0073195,"$266,567,580",Won 3 Oscars. 16 wins & 20 nominations total,Steven Spielberg,"Peter Benchley, Carl Gottlieb","Roy Scheider, Robert Shaw, Richard Dreyfuss","When a massive killer shark unleashes chaos on a beach community off Long Island, it's up to a local sheriff, a marine biologist, and an old seafarer to hunt the beast down.",English,United States,movie
Django Unchained,165 min,2012,R,25 Dec 2012,"Comedy, Drama, Western",87%,81/100,8.5,"1,742,451",tt1853728,"$162,805,434",Won 2 Oscars. 58 wins & 158 nominations total,Quentin Tarantino,Quentin Tarantino,"Jamie Foxx, Christoph Waltz, Leonardo DiCaprio","With the help of a German bounty-hunter, a freed slave sets out to rescue his wife from a brutal plantation owner in Mississippi.","English, German, French, Italian",United States,movie
The Shining,146 min,1980,R,13 Jun 1980,"Drama, Horror",83%,66/100,8.4,"1,139,463",tt0081505,"$45,634,352",6 wins & 9 nominations,Stanley Kubrick,"Stephen King, Stanley Kubrick, Diane Johnson","Jack Nicholson, Shelley Duvall, Danny Lloyd","A family heads to an isolated hotel for the winter, where a sinister presence influences the father into violence. At the same time, his psychic son sees horrifying forebodings from both the past and the future.",English,"United Kingdom, United States",movie
The Ultimate 'WALL-E' Recap Cartoon,5 min,2022,N/A,18 Feb 2022,"Animation, Short",N/A,N/A,N/A,N/A,tt20453422,N/A,No Awards,"Brian Bear, Cas van de Pol","Cas van de Pol, Brian Bear, Christopher Yeh","Pepijn Hikspoors, Joe Porter",N/A,English,Netherlands,movie
The Dark Knight Rises,164 min,2012,PG-13,20 Jul 2012,"Action, Drama, Thriller",87%,78/100,8.4,"1,867,630",tt1345836,"$448,149,584",Nominated for 1 BAFTA Award45 wins & 103 nominations total,Christopher Nolan,"Jonathan Nolan, Christopher Nolan, David S. Goyer","Christian Bale, Tom Hardy, Anne Hathaway","Bane, an imposing terrorist, attacks Gotham City and disrupts its eight-year-long period of peace. This forces Bruce Wayne to come out of hiding and don the cape and cowl of Batman again.","English, Arabic","United States, United Kingdom",movie
The Great Dictator,125 min,1940,G,07 Mar 1941,"Comedy, Drama, War",92%,N/A,8.4,"240,980",tt0032553,N/A,Nominated for 5 Oscars. 7 wins & 6 nominations total,Charles Chaplin,Charles Chaplin,"Charles Chaplin, Paulette Goddard, Jack Oakie",Dictator Adenoid Hynkel tries to expand his empire while a poor Jewish barber tries to avoid persecution from Hynkel's regime.,"English, Esperanto, Latin",United States,movie
Raiders of the Lost Ark,115 min,1981,PG,12 Jun 1981,"Action, Adventure",93%,85/100,8.4,"1,052,696",tt0082971,"$248,159,971",Won 4 Oscars. 38 wins & 24 nominations total,Steven Spielberg,"Lawrence Kasdan, George Lucas, Philip Kaufman","Harrison Ford, Karen Allen, Paul Freeman","In 1936, archaeologists and adventurers of the U.S. government hired Indiana Jones to find the Ark of the Covenant before the Nazis could obtain its extraordinary powers.","English, German, Spanish, Nepali, Hebrew, Arabic",United States,movie
