Title,Length,Year,Rated,Released,Genre,RottenTomatoesRating,MetacriticRating,imdbRating,imdbVotes,imdbID,BoxOffice,Awards,Director,Writer,Actors,Plot,Language,Country,Type:
The Social Network,120 min,2010,PG-13,01 Oct 2010,"Biography, Drama",96%,95/100,7.8,"773,447",tt1285016,"$96,962,694",Won 3 Oscars. 173 wins & 187 nominations total,David Fincher,"Aaron Sorkin, Ben Mezrich","Jesse Eisenberg, Andrew Garfield, Justin Timberlake","As Harvard student Mark Zuckerberg creates the social networking site that would become known as Facebook, he is sued by the twins who claimed he stole their idea and by the co-founder who was later squeezed out of the business.","English, French",United States,movie
Casablanca,102 min,1942,PG,23 Jan 1943,"Drama, Romance, War",99%,100/100,8.5,"615,791",tt0034583,"$4,219,709",Won 3 Oscars. 14 wins & 11 nominations total,Michael Curtiz,"Julius J. Epstein, Howard Koch, Murray Burnett","Humphrey Bogart, Ingrid Bergman, Paul Henreid",A cynical expatriate American cafe owner struggles to decide whether or not to help his former lover and her fugitive husband escape the Nazis in French Morocco.,"English, French, German, Italian, Russian",United States,movie
Amélie,122 min,2001,R,08 Feb 2002,"Comedy, Romance",90%,69/100,8.3,"805,625",tt0211915,"$33,712,444",Nominated for 5 Oscars. 59 wins & 74 nominations total,Jean-Pierre Jeunet,"Guillaume Laurant, Jean-Pierre Jeunet","Audrey Tautou, Mathieu Kassovitz, Rufus","Despite being caught in her imaginative world, Amelie, a young waitress, decides to help people find happiness. Her quest to spread joy leads her on a journey where she finds true love.","French, Russian, English","France, Germany",movie
Saving Private Ryan,169 min,1998,R,24 Jul 1998,"Drama, War",94%,91/100,8.6,"1,528,812",tt0120815,"$217,049,603",Won 5 Oscars. 79 wins & 75 nominations total,Steven Spielberg,Robert Rodat,"Tom Hanks, Matt Damon, Tom Sizemore","Following the Normandy Landings, a group of U.S. soldiers go behind enemy lines to retrieve a paratrooper whose brothers have been killed in action.","English, French, German, Czech",United States,movie
Spirited Away,124 min,2001,PG,28 Mar 2003,"Animation, Adventure, Family",96%,96/100,8.6,"880,329",tt0245429,"$15,205,725",Won 1 Oscar. 58 wins & 31 nominations total,Hayao Miyazaki,Hayao Miyazaki,"Daveigh Chase, Suzanne Pleshette, Miyu Irino","During her family's move to the suburbs, a sullen 10-year-old girl wanders into a world ruled by gods, witches and spirits, and where humans are changed into beasts.",Japanese,"Japan, United States",movie
The Seven Year Itch,105 min,1955,Approved,02 Jul 1955,"Comedy, Romance",84%,N/A,7.1,"43,322",tt0048605,N/A,Nominated for 1 BAFTA Award2 wins & 3 nominations total,Billy Wilder,"Billy Wilder, George Axelrod","Marilyn Monroe, Tom Ewell, Evelyn Keyes","When his family goes away for the summer, a hitherto faithful husband with an overactive imagination is tempted by a beautiful neighbor.",English,United States,movie
12 Angry Men,96 min,1957,Approved,10 Apr 1957,"Crime, Drama",100%,97/100,9.0,"891,794",tt0050083,N/A,Nominated for 3 Oscars. 16 wins & 12 nominations total,Sidney Lumet,Reginald Rose,"Henry Fonda, Lee J. Cobb, Martin Balsam",The jury in a New York City murder trial is frustrated by a single member whose skeptical caution forces them to more carefully consider the evidence before jumping to a hasty verdict.,English,United States,movie
Alien,117 min,1979,R,22 Jun 1979,"Horror, Sci-Fi",93%,89/100,8.5,"990,929",tt0078748,"$84,206,106",Won 1 Oscar. 19 wins & 22 nominations total,Ridley Scott,"Dan O'Bannon, Ronald Shusett","Sigourney Weaver, Tom Skerritt, John Hurt","After investigating a mysterious transmission of unknown origin, the crew of a commercial spacecraft encounters a deadly lifeform.",English,"United Kingdom, United States",movie
The Truman Show,103 min,1998,PG,05 Jun 1998,"Comedy, Drama",94%,90/100,8.2,"1,234,214",tt0120382,"$125,618,201",Nominated for 3 Oscars. 40 wins & 69 nominations total,Peter Weir,Andrew Niccol,"Jim Carrey, Ed Harris, Laura Linney",An insurance salesman discovers his whole life is actually a reality TV show.,English,United States,movie
The Breakfast Club,97 min,1985,R,15 Feb 1985,"Comedy, Drama",89%,66/100,7.8,"447,799",tt0088847,"$45,875,171",4 wins,John Hughes,John Hughes,"Emilio Estevez, Judd Nelson, Molly Ringwald",Five high school students meet in Saturday detention and discover how they have a great deal more in common than they thought.,English,United States,movie
The Grand Budapest Hotel,99 min,2014,R,28 Mar 2014,"Adventure, Comedy, Crime",92%,88/100,8.1,"903,794",tt2278388,"$59,301,324",Won 4 Oscars. 135 wins & 226 nominations total,Wes Anderson,"Stefan Zweig, Wes Anderson, Hugo Guinness","Ralph Fiennes, F. Murray Abraham, Mathieu Amalric","A writer encounters the owner of an aging high-class hotel, who tells him of his early years serving as a lobby boy in the hotel's glorious years under an exceptional concierge.","English, French, German","United States, Germany",movie
The Thing,109 min,1982,R,25 Jun 1982,"Horror, Mystery, Sci-Fi",85%,57/100,8.2,"481,701",tt0084787,"$19,857,465",5 nominations,John Carpenter,"Bill Lancaster, John W. Campbell Jr.","Kurt Russell, Wilford Brimley, Keith David",A research team in Antarctica is hunted by a shape-shifting alien that assumes the appearance of its victims.,"English, Norwegian","United States, Canada",movie
Braveheart,178 min,1995,R,24 May 1995,"Biography, Drama, War",76%,68/100,8.3,"1,108,282",tt0112573,"$75,609,945",Won 5 Oscars. 34 wins & 34 nominations total,Mel Gibson,Randall Wallace,"Mel Gibson, Sophie Marceau, Patrick McGoohan",Scottish warrior William Wallace leads his countrymen in a rebellion to free his homeland from the tyranny of King Edward I of England.,"English, French, Latin, Gaelic, Italian",United States,movie
A Clockwork Orange,136 min,1971,R,02 Feb 1972,"Crime, Sci-Fi",86%,77/100,8.2,"895,155",tt0066921,"$26,617,553",Nominated for 4 Oscars. 12 wins & 26 nominations total,Stanley Kubrick,"Stanley Kubrick, Anthony Burgess","Malcolm McDowell, Patrick Magee, Michael Bates",Alex DeLarge and his droogs barbarize a decaying near-future.,English,"United Kingdom, United States",movie
The Lion in Winter,134 min,1968,PG,30 Oct 1968,"Biography, Drama, History",91%,N/A,7.9,"34,706",tt0063227,"$18,177",Won 3 Oscars. 16 wins & 18 nominations total,Anthony Harvey,James Goldman,"Peter O'Toole, Katharine Hepburn, Anthony Hopkins","1183 A.D.: King Henry II's three sons all want to inherit the throne, but he won't commit to a choice. When he allows his imprisoned wife Eleanor of Aquitaine out for a Christmas visit, they all variously plot to force him into a ...","English, French, Latin","United Kingdom, United States",movie
The Sixth Sense,107 min,1999,PG-13,06 Aug 1999,"Drama, Mystery, Thriller",86%,64/100,8.2,"1,077,246",tt0167404,"$293,506,292",Nominated for 6 Oscars. 37 wins & 56 nominations total,M. Night Shyamalan,M. Night Shyamalan,"Bruce Willis, Haley Joel Osment, Toni Collette",A child psychologist starts treating a young boy with a disturbing secret.,"English, Latin, Spanish",United States,movie
The Big Lebowski,117 min,1998,R,06 Mar 1998,"Comedy, Crime",80%,71/100,8.1,"873,677",tt0118715,"$19,301,403",5 wins & 18 nominations,"Joel Coen, Ethan Coen","Ethan Coen, Joel Coen","Jeff Bridges, John Goodman, Julianne Moore","Jeff ""The Dude"" Lebowski, mistaken for a millionaire of the same name, seeks restitution for his ruined rug and enlists his bowling buddies to help get it.","English, German, Hebrew, Spanish","United Kingdom, United States",movie
Raging Bull,129 min,1980,R,19 Dec 1980,"Biography, Drama, Sport",92%,90/100,8.1,"387,774",tt0081398,"$23,383,987",Won 2 Oscars. 24 wins & 28 nominations total,Martin Scorsese,"Jake LaMotta, Joseph Carter, Peter Savage","Robert De Niro, Cathy Moriarty, Joe Pesci","The life of boxer Jake LaMotta, whose violence and temper that led him to the top in the ring destroyed his life outside of it.",English,United States,movie
No Country for Old Men,122 min,2007,R,21 Nov 2007,"Crime, Drama, Thriller",93%,92/100,8.2,"1,090,982",tt0477348,"$74,283,625",Won 4 Oscars. 164 wins & 139 nominations total,"Ethan Coen, Joel Coen","Joel Coen, Ethan Coen, Cormac McCarthy","Tommy Lee Jones, Javier Bardem, Josh Brolin",Violence and mayhem ensue after a hunter stumbles upon the aftermath of a drug deal gone wrong and over two million dollars in cash near the Rio Grande.,"English, Spanish",United States,movie
Memento,113 min,2000,R,25 May 2001,"Mystery, Thriller",94%,83/100,8.4,"1,347,376",tt0209144,"$25,544,867",Nominated for 2 Oscars. 57 wins & 59 nominations total,Christopher Nolan,"Christopher Nolan, Jonathan Nolan","Guy Pearce, Carrie-Anne Moss, Joe Pantoliano","Leonard Shelby, an insurance investigator, suffers from anterograde amnesia and uses notes and tattoos to hunt for the man he thinks killed his wife, which is the last thing he remembers.",English,United States,movie
La La Land,128 min,2016,PG-13,25 Dec 2016,"Comedy, Drama, Music",91%,94/100,8.0,"693,799",tt3783958,"$151,101,803",Won 6 Oscars. 242 wins & 307 nominations total,Damien Chazelle,Damien Chazelle,"Ryan Gosling, Emma Stone, Rosemarie DeWitt","When Sebastian, a pianist, and Mia, an actress, follow their passion and achieve success in their respective fields, they find themselves torn between their love for each other and their careers.","English, Cantonese","United States, Hong Kong",movie
Mad Max: Fury Road,120 min,2015,R,15 May 2015,"Action, Adventure, Sci-Fi",97%,90/100,8.1,"1,136,116",tt1392190,"$154,280,290",Won 6 Oscars. 245 wins & 233 nominations total,George Miller,"George Miller, Brendan McCarthy, Nick Lathouris","Tom Hardy, Charlize Theron, Nicholas Hoult","In a post-apocalyptic wasteland, a woman rebels against a tyrannical ruler in search for her homeland with the aid of a group of female prisoners, a psychotic worshipper and a drifter named Max.","English, Russian","Australia, United States",movie
Trainspotting,93 min,1996,R,09 Aug 1996,Drama,90%,83/100,8.1,"736,931",tt0117951,"$16,491,080",Nominated for 1 Oscar. 23 wins & 35 nominations total,Danny Boyle,"Irvine Welsh, John Hodge","Ewan McGregor, Ewen Bremner, Jonny Lee Miller","Renton, deeply immersed in the Edinburgh drug scene, tries to clean up and get out despite the allure of drugs and the influence of friends.",English,"United Kingdom, United States",movie
Zootopia,108 min,2016,PG,04 Mar 2016,"Animation, Action, Adventure",98%,78/100,8.0,"562,686",tt2948356,"$341,268,248",Won 1 Oscar. 49 wins & 75 nominations total,"Byron Howard, Rich Moore, Jared Bush","Byron Howard, Rich Moore, Jared Bush","Ginnifer Goodwin, Jason Bateman, Idris Elba","In a city of anthropomorphic animals, a rookie bunny cop and a cynical con artist fox must work together to uncover a conspiracy.",English,United States,movie
The Shape of Water,123 min,2017,R,22 Dec 2017,"Drama, Fantasy, Romance",92%,87/100,7.3,"453,788",tt5580390,"$63,859,435",Won 4 Oscars. 138 wins & 350 nominations total,Guillermo del Toro,"Guillermo del Toro, Vanessa Taylor","Sally Hawkins, Octavia Spencer, Michael Shannon","At a top secret research facility in the 1960s, a lonely janitor forms a unique relationship with an amphibious creature that is being held in captivity.","English, American Sign , Russian, French","United States, Mexico",movie
The Hateful Eight,168 min,2015,R,30 Dec 2015,"Crime, Drama, Mystery",74%,68/100,7.8,"675,621",tt3460252,"$54,117,416",Won 1 Oscar. 46 wins & 116 nominations total,Quentin Tarantino,Quentin Tarantino,"Samuel L. Jackson, Kurt Russell, Jennifer Jason Leigh","In the dead of a Wyoming winter, a bounty hunter and his prisoner find shelter in a cabin currently inhabited by a collection of nefarious characters.","English, Spanish, French, Persian",United States,movie
Moonlight,111 min,2016,R,18 Nov 2016,Drama,98%,99/100,7.4,"336,819",tt4975722,"$27,854,932",Won 3 Oscars. 235 wins & 310 nominations total,Barry Jenkins,"Barry Jenkins, Tarell Alvin McCraney","Mahershala Ali, Naomie Harris, Trevante Rhodes","A young African-American man grapples with his identity and sexuality while experiencing the everyday struggles of childhood, adolescence, and burgeoning adulthood.",English,United States,movie
The Revenant,156 min,2015,R,08 Jan 2016,"Action, Adventure, Drama",78%,76/100,8.0,"893,334",tt1663202,"$183,637,894",Won 3 Oscars. 92 wins & 193 nominations total,Alejandro G. Iñárritu,"Mark L. Smith, Alejandro G. Iñárritu, Michael Punke","Leonardo DiCaprio, Tom Hardy, Will Poulter",A frontiersman on a fur trading expedition in the 1820s fights for survival after being mauled by a bear and left for dead by members of his own hunting team.,"English, Pawnee, French","Hong Kong, Taiwan, United States",movie
Arrival,116 min,2016,PG-13,11 Nov 2016,"Drama, Mystery, Sci-Fi",94%,81/100,7.9,"794,547",tt2543164,"$100,546,139",Won 1 Oscar. 71 wins & 268 nominations total,Denis Villeneuve,"Eric Heisserer, Ted Chiang","Amy Adams, Jeremy Renner, Forest Whitaker","Linguist Louise Banks leads a team of investigators when gigantic spaceships touch down around the world. As nations teeter on the verge of global war, Banks and her crew must find a way to communicate with the extraterrestrial vi...","English, Mandarin, Russian","United States, Canada",movie
The Wolf of Wall Street,180 min,2013,R,25 Dec 2013,"Biography, Comedy, Crime",79%,75/100,8.2,"1,629,645",tt0993846,"$116,900,694",Nominated for 5 Oscars. 37 wins & 179 nominations total,Martin Scorsese,"Terence Winter, Jordan Belfort","Leonardo DiCaprio, Jonah Hill, Margot Robbie","Based on the true story of Jordan Belfort, from his rise to a wealthy stock-broker living the high life to his fall involving crime, corruption and the federal government.","English, French",United States,movie
Get Out,104 min,2017,R,24 Feb 2017,"Horror, Mystery, Thriller",98%,85/100,7.8,"735,721",tt5052448,"$176,196,665",Won 1 Oscar. 153 wins & 214 nominations total,Jordan Peele,Jordan Peele,"Daniel Kaluuya, Allison Williams, Bradley Whitford","A young African-American visits his white girlfriend's parents for the weekend, where his simmering uneasiness about their reception of him eventually reaches a boiling point.","English, Swahili","United States, Japan",movie
Black Panther,134 min,2018,PG-13,16 Feb 2018,"Action, Adventure, Sci-Fi",96%,88/100,7.3,"855,923",tt1825683,"$700,426,566",Won 3 Oscars. 124 wins & 290 nominations total,Ryan Coogler,"Ryan Coogler, Joe Robert Cole, Stan Lee","Chadwick Boseman, Michael B. Jordan, Lupita Nyong'o","T'Challa, heir to the hidden but advanced kingdom of Wakanda, must step forward to lead his people into a new future and must confront a challenger from his country's past.","English, Swahili, Nama, Xhosa, Korean",United States,movie
Her,126 min,2013,R,10 Jan 2014,"Drama, Romance, Sci-Fi",95%,91/100,8.0,"683,445",tt1798709,"$25,568,251",Won 1 Oscar. 83 wins & 186 nominations total,Spike Jonze,Spike Jonze,"Joaquin Phoenix, Amy Adams, Scarlett Johansson","In the near future, a lonely writer develops an unlikely relationship with an operating system designed to meet his every need.",English,United States,movie
A Beautiful Mind,135 min,2001,PG-13,04 Jan 2002,"Biography, Drama, Mystery",74%,72/100,8.2,"1,005,100",tt0268978,"$170,742,341",Won 4 Oscars. 37 wins & 69 nominations total,Ron Howard,"Akiva Goldsman, Sylvia Nasar","Russell Crowe, Ed Harris, Jennifer Connelly","A mathematical genius, John Nash made an astonishing discovery early in his career and stood on the brink of international acclaim. But the handsome and arrogant Nash soon found himself on a harrowing journey of self-discovery.",English,United States,movie
The Secret in Their Eyes,129 min,2009,R,21 May 2010,"Drama, Mystery, Romance",89%,80/100,8.2,"227,177",tt1305806,"$6,391,436",Won 1 Oscar. 53 wins & 43 nominations total,Juan José Campanella,"Eduardo Sacheri, Juan José Campanella","Ricardo Darín, Soledad Villamil, Pablo Rago",A retired legal counselor writes a novel hoping to find closure for one of his past unresolved homicide cases and for his unreciprocated love with his superior - both of which still haunt him decades later.,Spanish,"Argentina, Spain",movie
The Curious Case of Benjamin Button,166 min,2008,PG-13,25 Dec 2008,"Drama, Fantasy, Romance",72%,70/100,7.8,"707,669",tt0421715,"$127,509,326",Won 3 Oscars. 85 wins & 160 nominations total,David Fincher,"Eric Roth, Robin Swicord, F. Scott Fitzgerald","Brad Pitt, Cate Blanchett, Tilda Swinton","Benjamin Button, born in 1918 with the physical state of an elderly man, ages in reverse. He experiences love and break-ups, ecstasy and sorrow, and timelessness by the time he dies in 2003 as a baby.","English, Russian, French",United States,movie
Gravity,91 min,2013,PG-13,04 Oct 2013,"Drama, Sci-Fi, Thriller",96%,96/100,7.7,"872,078",tt1454468,"$274,092,705",Won 7 Oscars. 240 wins & 187 nominations total,Alfonso Cuarón,"Alfonso Cuarón, Jonás Cuarón","Sandra Bullock, George Clooney, Ed Harris","Dr Ryan Stone, an engineer on her first time on a space mission, and Matt Kowalski, an astronaut on his final expedition, have to survive in space after they are hit by debris while spacewalking.","English, Greenlandic","United Kingdom, United States",movie
Dead Poets Society,128 min,1989,PG,09 Jun 1989,"Comedy, Drama",85%,79/100,8.1,"569,254",tt0097165,"$95,860,116",Won 1 Oscar. 20 wins & 19 nominations total,Peter Weir,Tom Schulman,"Robin Williams, Robert Sean Leonard, Ethan Hawke","Maverick teacher John Keating returns in 1959 to the prestigious New England boys' boarding school where he was once a star student, using poetry to embolden his pupils to new heights of self-expression.","English, Latin",United States,movie
Finding Nemo,100 min,2003,G,30 May 2003,"Animation, Adventure, Comedy",99%,90/100,8.2,"1,136,898",tt0266543,"$380,843,261",Won 1 Oscar. 49 wins & 63 nominations total,"Andrew Stanton, Lee Unkrich","Andrew Stanton, Bob Peterson, David Reynolds","Albert Brooks, Ellen DeGeneres, Alexander Gould","After his son is captured in the Great Barrier Reef and taken to Sydney, a timid clownfish sets out on a journey to bring him home.","English, Japanese, Russian","United States, Japan",movie
The Wizard of Oz,102 min,1939,G,25 Aug 1939,"Adventure, Family, Fantasy",98%,92/100,8.1,"437,377",tt0032138,"$24,668,669",Won 2 Oscars. 13 wins & 14 nominations total,"Victor Fleming, King Vidor","Noel Langley, Florence Ryerson, Edgar Allan Woolf","Judy Garland, Frank Morgan, Ray Bolger","Young Dorothy Gale and her dog Toto are swept away by a tornado from their Kansas farm to the magical Land of Oz and embark on a quest with three new friends to see the Wizard, who can return her to her home and fulfill the others...",English,United States,movie
The Graduate,106 min,1967,PG,21 Dec 1967,"Comedy, Drama, Romance",87%,83/100,8.0,"292,985",tt0061722,"$104,945,305",Won 1 Oscar. 22 wins & 17 nominations total,Mike Nichols,"Calder Willingham, Buck Henry, Charles Webb","Dustin Hoffman, Anne Bancroft, Katharine Ross",A disillusioned college graduate finds himself torn between his older lover and her daughter.,English,United States,movie
The Maltese Falcon,100 min,1941,Approved,18 Oct 1941,"Crime, Film-Noir, Mystery",99%,97/100,7.9,"168,508",tt0033870,"$18,180",Nominated for 3 Oscars. 5 wins & 4 nominations total,John Huston,"John Huston, Dashiell Hammett","Humphrey Bogart, Mary Astor, Gladys George","San Francisco private detective Sam Spade takes on a case that involves him with three eccentric criminals, a gorgeous liar and their quest for a priceless statuette, with the stakes rising after his partner is murdered.",English,United States,movie
The King's Speech,118 min,2010,R,25 Dec 2010,"Biography, Drama, History",94%,88/100,8.0,"714,473",tt1504320,"$138,797,449",Won 4 Oscars. 109 wins & 206 nominations total,Tom Hooper,David Seidler,"Colin Firth, Geoffrey Rush, Helena Bonham Carter","The story of King George VI, his unexpected ascension to the throne of the British Empire in 1936, and the speech therapist who helped the unsure monarch overcome his stammer.",English,"United States, United Kingdom",movie
The Nightmare Before Christmas,76 min,1993,PG,29 Oct 1993,"Animation, Family, Fantasy",95%,82/100,7.9,"385,126",tt0107688,"$93,570,101",Nominated for 1 Oscar. 7 wins & 17 nominations total,Henry Selick,"Tim Burton, Michael McDowell, Caroline Thompson","Danny Elfman, Chris Sarandon, Catherine O'Hara","Jack Skellington, king of Halloween Town, discovers Christmas Town, but his attempts to bring Christmas to his home causes confusion.",English,United States,movie
The Incredibles,115 min,2004,PG,05 Nov 2004,"Animation, Action, Adventure",N/A,90/100,8.0,"833,041",tt0317705,"$261,441,092",Won 2 Oscars. 69 wins & 56 nominations total,Brad Bird,Brad Bird,"Craig T. Nelson, Samuel L. Jackson, Holly Hunter","While trying to lead a quiet suburban life, a family of undercover superheroes are forced into action to save the world.","English, French, German, Italian, Portuguese, Russian",United States,movie
Hacksaw Ridge,139 min,2016,R,04 Nov 2016,"Biography, Drama, History",84%,71/100,8.1,"616,821",tt2119532,"$67,209,615",Won 2 Oscars. 57 wins & 115 nominations total,Mel Gibson,"Robert Schenkkan, Andrew Knight","Andrew Garfield, Sam Worthington, Luke Bracey","World War II American Army Medic Desmond T. Doss, serving during the Battle of Okinawa, refuses to kill people and becomes the first man in American history to receive the Medal of Honor without firing a shot.","English, Japanese",United States,movie
